{
  "candidate_id": "MAD-SKILL-013",
  "name": "Browser and Visual QA Gate",
  "status": "candidate_only",
  "registered_experiment": false,
  "catalog_visible": true,
  "recommendation_eligible": false,
  "execution_routing_allowed": false,
  "implementation_exists": false,
  "execution_authorized": false,
  "customer_decision": "not_approved",
  "network_authorized": false,
  "dependency_install_authorized": false,
  "external_service_authorized": false,
  "promotion_allowed": false,
  "source_status": "verification_blocked",
  "authoritative_state": true
}
